{
  "schema_version": 1,
  "artifact_kind": "pooleos_native_boot_trust_readiness",
  "contract_id": "PBTRUST1",
  "status": "pass",
  "inputs": {
    "contract": {
      "path": "specs/native-boot-trust-contract.json",
      "byte_count": 12029,
      "sha256": "D954A4706C42EBFEEE8E43FE7ECA330156BF7A5E04974E14D6C2565E494B2246"
    },
    "toolchain_lock": {
      "path": "specs/native-toolchain-lock.json",
      "byte_count": 4017,
      "sha256": "79084B39BC43C0B3B96ABE93328184338470A2FFFF257C6E2305215E6B2CCA4E"
    },
    "toolchain_qualification": {
      "path": "runs/native_toolchain_qualification.json",
      "byte_count": 14423,
      "sha256": "87668ADC571427244CD490D172CD01BAA3871709A0D76F7319D665526B68CFB5"
    },
    "tier1_profile": {
      "path": "runs/hardware_target_readiness.json",
      "byte_count": 25583,
      "sha256": "A958A21D88F73A2BFB576EBE03ABADDDBAFBF474E236041D47434FA7718046F4"
    },
    "implementation_inputs": [
      {
        "path": "native/.cargo/config.toml",
        "byte_count": 539,
        "sha256": "7983881C5CAD2B909CCA64BFA7F5895EC56377B0E52967444CB2818A69FA4FE1"
      },
      {
        "path": "native/rust-toolchain.toml",
        "byte_count": 131,
        "sha256": "06C4E0BD63FE84DCB26A0FAE52D96F23C38979DBE6F154D58EAB1547F81FA26B"
      },
      {
        "path": "specs/native-toolchain-lock.json",
        "byte_count": 4017,
        "sha256": "79084B39BC43C0B3B96ABE93328184338470A2FFFF257C6E2305215E6B2CCA4E"
      },
      {
        "path": "specs/native-host-msvc-profile.json",
        "byte_count": 2092,
        "sha256": "4BD6B069392E11215EE1942425B3A12CE2CAEC6746A9450EAC20B037FC538182"
      },
      {
        "path": "tools/native_host_toolchain.py",
        "byte_count": 5317,
        "sha256": "4AC87084B9B1F023C1FE2518858899A4A71BF90B9CA4DF3D312E342257E3099F"
      },
      {
        "path": "tools/qualify_native_toolchain.py",
        "byte_count": 22364,
        "sha256": "655FCC0A572AE4FB2899840007F22A31CDCF9D114952C60F657EE3F4BF0F9C50"
      },
      {
        "path": "tests/test_native_boot_host_toolchain.py",
        "byte_count": 8247,
        "sha256": "39514B13649D45BB60C2C0471F80F45D4B176C018ED7C7B9B430BC4D8DE63C02"
      },
      {
        "path": "native/Cargo.toml",
        "byte_count": 601,
        "sha256": "210BCDAF2778606B42C688E7BACD950FC0EEF3045081E884CF7846B9A7D78DF4"
      },
      {
        "path": "native/Cargo.lock",
        "byte_count": 4193,
        "sha256": "29CE9938C5C60DEA5AEA244A6961BB1924D88AEC601D1E02EAAA510B0B36E390"
      },
      {
        "path": "native/trust/Cargo.toml",
        "byte_count": 358,
        "sha256": "E93435C23773EE33FC8757976903AA52C05985C0C4534D09EDADDCB8796D242C"
      },
      {
        "path": "native/trust/src/lib.rs",
        "byte_count": 27894,
        "sha256": "E075E10153BC4987000F9C99931568165A3E8726786E6F5D69C164BCD833EE81"
      },
      {
        "path": "native/trust/src/backend.rs",
        "byte_count": 24056,
        "sha256": "0C5DBF62CE26DEAD2241385578FDF76DBF9A235751FE2345DE53DBF29AC6C2BF"
      },
      {
        "path": "native/trust/src/bin/pbtrust1_probe.rs",
        "byte_count": 8631,
        "sha256": "35B0CE8EC004E0F878F2E90969CA2317FC5335C765D8B5205E06E1D34608FCD8"
      },
      {
        "path": "native/boot/Cargo.toml",
        "byte_count": 1863,
        "sha256": "C9175879FB21AAE932016F9E1E4F46DD0070BF0D6A2DB32AB370AF7C4D0687F6"
      },
      {
        "path": "native/boot/src/kload.rs",
        "byte_count": 44327,
        "sha256": "9DDADC0BF6E741148BD08C30C6DC099F3B57E63CC972A57346C6D538737E3212"
      },
      {
        "path": "native/boot/src/main.rs",
        "byte_count": 21883,
        "sha256": "A5D9BA6D0F1EDE8F67A04DD6FD49D13A7FD2F2EAFE66FFABE455AA0C7321A18B"
      },
      {
        "path": "native/bootload/src/lib.rs",
        "byte_count": 32723,
        "sha256": "BA06EF5B0FCA2298B855E2C8FFBD7C831C6F6938234B9FD6C1E616C948D135C1"
      },
      {
        "path": "runtime/native_boot_trust.py",
        "byte_count": 43926,
        "sha256": "0E12DA5C48D9E3427D087B24151B498E1DD07536253E746512A8A8F0E7BBE8E0"
      },
      {
        "path": "tests/test_native_boot_trust.py",
        "byte_count": 16467,
        "sha256": "F389F780CBA24EEFC3F9B78B77D7796910603B398764DD5F49046EAC2FB68C40"
      },
      {
        "path": "tools/qualify_native_boot_trust.py",
        "byte_count": 58011,
        "sha256": "444355BB522104E4C61EDE4B3225AEDDA06BB91277C781C627BDD57AA6DE658D"
      },
      {
        "path": "docs/native-boot-trust.md",
        "byte_count": 9968,
        "sha256": "3B29ADAEA74AF3172D99B52CC15A70B2EF2AC0EE8737FDF1B785B4BFF84642C6"
      },
      {
        "path": "specs/native-boot-trust-contract.schema.json",
        "byte_count": 4977,
        "sha256": "CCB0EFAE93AC5AFD5B88077DDCDFCF4E75595CB120FD275B5553F43B364E1DC1"
      },
      {
        "path": "specs/native-boot-trust-readiness.schema.json",
        "byte_count": 9037,
        "sha256": "CDE62C2955478239135E549A16E2F19E6B094344DBEDC449741CE540E92F8108"
      }
    ]
  },
  "build": {
    "rustc": "rustc 1.97.0 (2d8144b78 2026-07-07)",
    "host_toolchain": {
      "profile_id": "POOLEOS-HOST-MSVC-1",
      "profile_sha256": "4BD6B069392E11215EE1942425B3A12CE2CAEC6746A9450EAC20B037FC538182",
      "verified_before_build": true,
      "scope": "host_linker_and_library_trees_not_complete_host_attestation"
    },
    "rust_host_tests_passed": 12,
    "rust_host_tests_total": 12,
    "rustfmt_packages": 1,
    "clippy_targets": 1,
    "no_std_targets": [
      "x86_64-unknown-none",
      "x86_64-unknown-uefi"
    ],
    "pooleboot_uefi_integration_builds_passed": 1,
    "pooleboot_uefi_integration_builds_total": 1
  },
  "golden": {
    "case_count": 5,
    "development_policy_sha256": "AA256F8CDAFB6AA7778062923323E75A100C12DB366028A7039EF23FB6EF85E6",
    "development_state_sha256": "3FD0C11A8618A3E67E1A0D0486C2EE6757FEEEAE973382A904D916308BB8650D",
    "signed_shape_policy_sha256": "23D66D75BCBAFAFEB6C8467B3C00D07528D77C7ED3E44D4A0ED7A7A4CF274D5B",
    "authenticated_shape_state_sha256": "715A00CA7C845ECCDF06E1FBF2014CBE983388428F96CFFC4B7D4714A27D84A9",
    "generation_two_state_sha256": "BE076052B03D9EA0951B06A1E7A85BCD13A8F62189ABBA69C2EC155F0FF85370",
    "backend_copy_zero_sha256": "A4DD75C70B22F80830C3473B48F7A06B590D0EF96FC5FC042146F432A4F9BF8E",
    "backend_copy_one_sha256": "752CB73AB68C61770FBDE765FC586124154828551646DE32CABC6D75465BC3CA",
    "backend_logical_state_sha256": "0900B1A0AC280F11AABB5C648F1B74A9073BC16F2675C69A2C4A1F74FD2C38B9",
    "synthetic_authorization_model_result": "qualified_shape_only_no_crypto_claim"
  },
  "negative_controls": [
    {
      "id": "NEG-N5-PBTRUST-POLICY-TRUNCATED",
      "expected": "ERR:pbtrust_policy_truncated",
      "python": "ERR:pbtrust_policy_truncated",
      "rust": "ERR:pbtrust_policy_truncated",
      "status": "pass"
    },
    {
      "id": "NEG-N5-PBTRUST-POLICY-OVERSIZE",
      "expected": "ERR:pbtrust_policy_size",
      "python": "ERR:pbtrust_policy_size",
      "rust": "ERR:pbtrust_policy_size",
      "status": "pass"
    },
    {
      "id": "NEG-N5-PBTRUST-POLICY-MAGIC",
      "expected": "ERR:pbtrust_policy_magic",
      "python": "ERR:pbtrust_policy_magic",
      "rust": "ERR:pbtrust_policy_magic",
      "status": "pass"
    },
    {
      "id": "NEG-N5-PBTRUST-POLICY-MAJOR",
      "expected": "ERR:pbtrust_policy_version",
      "python": "ERR:pbtrust_policy_version",
      "rust": "ERR:pbtrust_policy_version",
      "status": "pass"
    },
    {
      "id": "NEG-N5-PBTRUST-POLICY-MINOR",
      "expected": "ERR:pbtrust_policy_version",
      "python": "ERR:pbtrust_policy_version",
      "rust": "ERR:pbtrust_policy_version",
      "status": "pass"
    },
    {
      "id": "NEG-N5-PBTRUST-POLICY-RECORD-BYTES",
      "expected": "ERR:pbtrust_policy_size",
      "python": "ERR:pbtrust_policy_size",
      "rust": "ERR:pbtrust_policy_size",
      "status": "pass"
    },
    {
      "id": "NEG-N5-PBTRUST-POLICY-FLAGS-ZERO",
      "expected": "ERR:pbtrust_policy_flags",
      "python": "ERR:pbtrust_policy_flags",
      "rust": "ERR:pbtrust_policy_flags",
      "status": "pass"
    },
    {
      "id": "NEG-N5-PBTRUST-POLICY-FLAGS-BOTH",
      "expected": "ERR:pbtrust_policy_flags",
      "python": "ERR:pbtrust_policy_flags",
      "rust": "ERR:pbtrust_policy_flags",
      "status": "pass"
    },
    {
      "id": "NEG-N5-PBTRUST-POLICY-FLAGS-UNKNOWN",
      "expected": "ERR:pbtrust_policy_flags",
      "python": "ERR:pbtrust_policy_flags",
      "rust": "ERR:pbtrust_policy_flags",
      "status": "pass"
    },
    {
      "id": "NEG-N5-PBTRUST-POLICY-VERSION-ZERO",
      "expected": "ERR:pbtrust_policy_numbers",
      "python": "ERR:pbtrust_policy_numbers",
      "rust": "ERR:pbtrust_policy_numbers",
      "status": "pass"
    },
    {
      "id": "NEG-N5-PBTRUST-POLICY-EPOCH-ZERO",
      "expected": "ERR:pbtrust_policy_numbers",
      "python": "ERR:pbtrust_policy_numbers",
      "rust": "ERR:pbtrust_policy_numbers",
      "status": "pass"
    },
    {
      "id": "NEG-N5-PBTRUST-POLICY-SECURE-FLOOR-ZERO",
      "expected": "ERR:pbtrust_policy_numbers",
      "python": "ERR:pbtrust_policy_numbers",
      "rust": "ERR:pbtrust_policy_numbers",
      "status": "pass"
    },
    {
      "id": "NEG-N5-PBTRUST-POLICY-GENERATION-FLOOR-ZERO",
      "expected": "ERR:pbtrust_policy_numbers",
      "python": "ERR:pbtrust_policy_numbers",
      "rust": "ERR:pbtrust_policy_numbers",
      "status": "pass"
    },
    {
      "id": "NEG-N5-PBTRUST-POLICY-ROLE-MASK",
      "expected": "ERR:pbtrust_policy_role_mask",
      "python": "ERR:pbtrust_policy_role_mask",
      "rust": "ERR:pbtrust_policy_role_mask",
      "status": "pass"
    },
    {
      "id": "NEG-N5-PBTRUST-POLICY-RESERVED",
      "expected": "ERR:pbtrust_policy_signer_shape",
      "python": "ERR:pbtrust_policy_signer_shape",